{
  "schemaVersion": "1.0",
  "activationCodeId": "activation_example_a",
  "verifierHash": "sha256:0000000000000000000000000000000000000000000000000000000000000000",
  "status": "UNUSED",
  "createdByUserId": "usr_staff_example",
  "redeemedByUserId": null,
  "binding": { "kind": "NONE", "valueHash": null },
  "permissionProfile": {
    "role": "STUDENT",
    "courseId": "calculus_1151",
    "classCode": "01",
    "permissions": ["JOIN_COURSE", "ACCESS_DISCORD", "ASK_QUESTIONS"]
  },
  "createdAt": "2026-07-01T08:00:00+08:00",
  "expiresAt": "2026-07-08T08:00:00+08:00",
  "redeemedAt": null,
  "revokedAt": null,
  "redemptionRequestHash": null
}
